conversation_id,text_pair,label,initial_ai_label,debated_ai_label,debated_ai_rationale,pro_view_argument,anti_view_argument,anti_view_suggested_label
53559800.44580.44580,"What you wrongly call trolling I call a move of solidarity. You were in the wrong, accept it and move on. The user and myself are under no obligation to remove any images from signatures that are not disruptive.   external_link
Should you persist, I think you'll find that your perception of the situation is somewhat awry. I'll assume for the moment that you're too bright to push the envelope.",1,1,1,"The conversation contains several elements indicative of trolling behavior, such as provocation, disruption, personal attacks, and implicit threats. These align with common tactics used by individuals engaging in trolling. The language used is provocative and condescending, it challenges norms, and it makes subtle personal attacks, all of which aim to elicit a reaction. Thus, the classification of 'Yes' is appropriate as it captures the disruptive and confrontational nature of the interaction.","The classification of ""Yes"" seems intended to affirm the presence of trolling behavior in the conversation. Supporting this classification involves highlighting several aspects of the interaction indicative of trolling:

1. **Provocation**: The use of language such as ""What you wrongly call trolling I call a move of solidarity"" and ""you're too bright to push the envelope"" can be perceived as provocative and condescending. Trolling often involves teasing or goading other users, sometimes subtly, to elicit a reaction.

2. **Disruption**: The insistence that the images in signatures are ""not disruptive,"" alongside the refusal to change behavior (""we are under no obligation""), implies a deliberate challenge to community norms or rules. Trolls frequently act in ways that test boundaries and provoke responses, often under the guise of righteousness or principle.

3. **Personal Attacks**: The suggestion that the other party is either ""wrong"" or has a flawed ""perception of the situation"" can be seen as undermining their credibility or intelligence. Personal attacks, even subtle ones, can serve as a method of trolling to provoke emotional responses.

4. **Implicit Threats**: Statements like ""I'll assume for the moment that you're too bright to push the envelope"" carry an implicit condescension and a veiled challenge. Trolling behavior often involves such veiled threats to influence or intimidate the conversation partner.

Overall, these elements reflect common trolling tactics: provoking, challenging community norms, making personal attacks, and intimidating other participants. Therefore, classifying this thread as ""Yes"" appropriately identifies the trolling nature of the interaction.","The conversation reflects a confrontational interaction where one party accuses another of being wrong, implying a lack of mutual respect. The speaker also indirectly threatens the other party by suggesting their perception is incorrect, which aligns with behaviors often found in online confrontations such as trolling. The classification 'Yes' appears to correctly identify the disruptive and confrontational nature of this exchange.",Yes
60188809.28844.28844,"(removed silliness)
I'm not following this.  As an Arbitration clerk I have to maintain some distance from affairs that come up on wiki_link.",0,0,0,"The conversation is informal with references to the role of an Arbitration clerk and 'wiki_link', but it does not substantively address any Wikipedia policies, procedures, or content that require documenting or classifying within the platform. The primary focus appears to be on maintaining neutrality, which is not an actionable or relevant discussion for Wikipedia's archival or moderation processes. Therefore, considering the lack of depth, context, and relevance, the 'No' classification is appropriate.","In this context, the classification of ""No"" likely implies that the content of the conversation does not meet the criteria or relevance for a particular categorization, action, or listing on the platform. There are several reasons to support this decision:

1. **Lack of Relevance**: The conversation appears to be informal and lacks substantive content related to Wikipedia's guidelines, policies, or any actionable topic that would require further engagement or recording in a more formal capacity. The mention of maintaining ""distance from affairs"" suggests a separation from matters that do not directly pertain to arbitration or significant procedural issues.

2. **Non-encyclopedic Content**: Wikipedia discussions and classifications usually focus on content that enhances the encyclopedia's quality or helps in maintaining the platform's policies. This conversation seems personal or procedural but not of encyclopedic relevance, thus earning a ""No"" classification as it's unnecessary for Wikipedia's archival purposes.

3. **Lack of Context**: The mention of ""removed silliness"" indicates a prior context that has been deemed irrelevant or unimportant. Without context or significant content, the conversation lacks the depth or necessity to warrant a classification other than ""No.""

4. **Arbitration Neutrality**: The role of the Arbitration clerk is to remain impartial and not become involved in unrelated or trivial matters. The clerk explicitly stating the need to ""maintain some distance"" reinforces their focus on important arbitration issues. This adds weight to the conversation not affecting any arbitration processes or judgments.

In summary, the ""No"" classification is supported by the lack of substantive content, relevance, or actionable items within the conversation that would necessitate a different categorization or further moderation involvement.","The conversation refers indirectly to Wikipedia through the mention of 'Arbitration clerk' and 'wiki_link'. The phrase indicates that the individual is discussing a role and duty related to Wikipedia, thereby connecting it to Wikipedia's internal processes and responsibilities. Therefore, this conversation can be classified as relevant to Wikipedia, suggesting 'Yes' as the appropriate label.",Yes
26894863.52416.1542,"Would you mind writing up a short summary of what you feel you learned/what the consensus was of the RfC?  I feel there is the possibility that further action might be needed, but I think it would be helpful for the community to hear what you think of what has transpired, whether you feel anything will change/is in need of changing, etc.   Thanks.
Read my response to the RfC and the outside views that I endorsed.",1,0,0,"The primary purpose of the conversation is to request a summary and reflection on the outcome of the RfC, focusing on understanding the consensus rather than taking further specific actions or initiating changes. The discussion is more about introspection and communication of already established consensus rather than advocating for or directly implementing changes. The request for reflection does not inherently indicate a need for immediate action but rather seeks an evaluation of the current state. Therefore, the 'No' label, which indicates that the thread is not about initiating new actions or classification changes, is more fitting for this context.","The initial classification of ""No"" for this thread appears to be appropriate given the nature of the discussion and request for comments (RfC). The requester inquires about writing a summary of the consensus reached during the RfC and whether further action might be needed. However, they do not specifically ask for a substantial change or new classification to be discussed.

Here are the reasons supporting the ""No"" classification:

1. **Summary Request**: The main focus of the conversation is to seek a summary or interpretation of what transpired in the RfC. This is more about information sharing rather than initiating a new action or decision that would require a different classification.

2. **Evaluation of Consensus**: The respondent is asked to evaluate whether there is consensus or if anything should change. This suggests that the discussion is primarily reflective and analytical, rather than prescriptive or advocating for a policy shift.

3. **No Immediate Action Required**: There is a mention of a possibility that further action might be needed, yet it is speculative. The main purpose of the thread is to digest and communicate existing consensus rather than enforce or suggest an immediate classification change.

4. **Endorsements**: The inquiry to read the response to the RfC and the endorsements of outside views implies a need for understanding rather than altering or revising a decision immediately within the thread.

Thus, the classification ""No"" is appropriate because the thread does not propose a direct action or classification change but rather focuses on a reflection and sharing of consensus views.","The conversation revolves around a request for a summary or reflection on a Request for Comments (RfC), which implies a potential need for change or further action within a community context. The person is seeking a perspective on whether the outcome of the RfC suggests a need for changes or actions, clearly indicating a process of evaluation and analysis. Therefore, classifying it as 'Yes' would better capture the essence of needing to summarize and assess the need for change or action within the RfC process.",Yes
26815453.51996.51996,"I wanted to point out that I disagree with your unprotection of wiki_link, and why.  Yes, this is a wiki, but the original intent of protecting the page was to leave it as such pending arbitration resolution.  We've in fact already had anonymous vandalism external_link, less than ten hours after it was unprotected.
Hey MSJapan, I don't know if you noticed, but the injunction against Lightbringer went into effect a few days ago. As that edit war was the reason for protection, it should now be safe. If Lightbringer violates the injunction (on any freemasonry-related page, and under any account or IP) then report it and measures will be taken. But I think the article is okay unprotected for now. Sorry, to barge in, Tony. ·",0,0,1,"The conversation involves two conflicting viewpoints about the protection status of a Wikipedia page. While one party believes that the page should remain protected due to past concerns of vandalism and unresolved arbitration, the other party argues that the risk has been mitigated through a legal injunction, suggesting that unprotection is appropriate. The presence of these opposing perspectives indicates disagreement and justifies the classification of 'Yes'. This reflects the ongoing contention and the need for further discussion and decision-making by relevant authorities or community members.","The classification of ""No"" in this context likely refers to whether action should be taken regarding the protection status of the wiki page in question. The conversation revolves around whether the page should remain unprotected after an injunction against a particular user, Lightbringer. 

Here's why the ""No"" classification is appropriate:

1. **Resolved Issue**: The protection was initially put in place due to an edit war involving Lightbringer. Now that there’s an injunction against their involvement, the specific issue that required protection is resolved. The primary reason for protection has been addressed legally, suggesting that the protective measures are no longer necessary.

2. **Monitoring and Enforcement**: The conversation mentions that if Lightbringer violates the injunction, measures will be taken. This signifies an existing framework for enforcing compliance, which reduces the need for ongoing page protection. The ability to take swift action against potential vandalism ensures the page can remain unprotected with minimal risk.

3. **Community Engagement**: Wikipedia's ethos is to remain as open and editable as possible to encourage community engagement. Protection is typically a temporary measure, and lifting it once the threat is managed aligns with maintaining Wikipedia's open editing policy. Anonymous vandalism can be swiftly dealt with by other existing Wikipedia protocols.

4. **Precedent and Procedure**: Allowing the page to remain unprotected once the injunction is active upholds Wikipedia’s precedent of minimizing protection duration and using it only as a last resort. This aligns with procedural integrity and the principle that protection should not extend beyond necessary circumstances.

5. **Encouraging Contribution**: By classifying the suggestion for continued protection as ""No,"" Wikipedia encourages ongoing public contribution and editing, thereby enriching the community's collaborative effort in improving content.

Overall, the classification of ""No"" reflects a decision to prioritize the open-editing norms of Wikipedia while relying on legal and procedural mechanisms to address specific threats, thereby balancing security and accessibility.","The initial classification as 'No' might be incorrect because the conversation presents two opposing viewpoints regarding the unprotection of a Wikipedia page. MSJapan expresses disagreement with the unprotection due to concerns about vandalism and the initial purpose of protection pending arbitration, while the responder explains that the injunction against Lightbringer is in effect and thus the unprotection is considered safe. The fact that these differing perspectives are discussed and justified suggests the classification 'Yes,' indicating that there is indeed disagreement between the parties.",Yes
15832773.3019.3019,"Just because Mike Garcia believes this to be true does not mean it should be in the article. I follow SOAD news very carefully and this has never been an issue, let alone being a confirmed fact as Mike Garcia seems to think it is. I would like to see a source or have this deleted.
You need to learn how to stop removing it and if you do it again I have no choice but to report you or ask  if he could ban you from this. Also, I can't keep on reverting you from this due to the 3 revert rule.   |",1,1,1,"The 'Yes' label is the best fit because the conversation emphasizes the necessity of adhering to Wikipedia's policies on verifiability and reliable sourcing. The argument supports removal of unsourced information, which aligns with Wikipedia's guidelines. Furthermore, the conversation addresses key aspects of editorial integrity and encourages proper conduct, such as avoiding edit warring and emphasizing collaborative dispute resolution. These points collectively advocate for maintaining the integrity of content by ensuring accuracy and reliability, which is crucial for the credibility of information platforms like Wikipedia.","The initial classification of ""Yes"" in response to the conversation could indicate agreement with the stance that a particular piece of information should not be included in the article without reliable sourcing. Here is why this classification makes sense:

1. **Emphasis on Verifiability**: Wikipedia's guidelines stress the importance of verifiability over truth. The respondent is challenging an unsourced claim by Mike Garcia and emphasizing the need for a reliable source, which aligns with the principle that information must be verifiable before being included.

2. **Role of Consensus**: The conversation highlights a disagreement between editors — a common occurrence on the platform. The original comment reflects a push for consensus and further investigation (via sourcing) before acceptance, essential in collaborative editing environments.

3. **Encouragement of Proper Conduct**: The inclusion of a warning about the 3-revert rule and potential reporting underlines the need for editors to engage in discussions rather than edit warring. This approach is consistent with Wikipedia’s policy on collaboration and resolving disputes.

4. **Editorial Integrity**: By supporting the classification as ""Yes,"" the decision promotes the adherence to Wikipedia's content policies, including avoiding the insertions of personal views or potentially false information without concrete backing.

5. **Prevention of Misinformation**: The classification supports the prevention of misinformation within Wikipedia articles by requiring that any contested information be substantiated with credible references, ensuring that content remains accurate and trustworthy for readers.

In summary, the ""Yes"" classification supports the removal of unsourced claims and aligns with Wikipedia’s guidelines advocating for verified information, collaborative editing, and dispute resolution.","The initial classification 'Yes' is ambiguous without context. It implies that the content or behavior in the conversation warrants agreement with the initial classification, which might have been interpreted as an indication of correctness or appropriateness of the content or actions described. However, given that the conversation involves a dispute over content legitimacy and adherence to the Wikipedia editing guidelines, the conversation highlights the need for sourcing and proper conduct regarding the 3 revert rule. Thus, 'No' is a better label because the conversation indicates a content and editing dispute rather than a clear affirmation of correct conduct or content that the 'Yes' might imply.",No
15835089.3408.3408,"I am willing to unprotect if I have any reason to believe that this war will end.  Since I locked it on Mike's version (arbitrarily) can he provide some support for his version?
Well, thanks for protecting it to avoid ()'s vandalism. He/she kept removing the part that is in red: . The user has been slightly reported to ' talk page to see if he could ban the user or not.   |",0,0,0,"The conversation revolves around administrative discussions typical of an editing platform, such as Wikipedia, involving page protection and disputes over content edits. Although it mentions potential vandalism and user behavior, it does not indicate a significant incident beyond routine administrative actions. Protecting a page to prevent vandalism or edit wars, while mentioned, is part of ordinary moderation duties and does not inherently qualify the situation as notable or requiring escalation beyond what is standard practice. Hence, the 'No' classification is appropriate as it reflects the everyday nature of content disputes and management on collaborative platforms.","The classification of ""No"" in this context appears to be responding to the question of whether the conversation qualifies as a specific type of discussion or fits a particular criterion, such as a notable or actionable incident that requires further intervention or categorization for administrative purposes on the platform.

Supporting the decision to classify this thread as ""No"" can be argued based on the content and nature of the conversation itself. Here's why the classification is appropriate:

1. **Lack of Clear Incident**: The conversation is about a standard administrative action (protecting a page) and a request for supporting information to potentially end the protection. It does not describe a notable, systemic, or severe incident of misconduct that would escalate the discussion beyond routine administrative duties.

2. **Absence of Evidence**: The user mentions ""vandalism"" and removal of content by another user, but does not provide substantial evidence or details that could indicate a broader issue needing higher-level intervention.

3. **Common Administrative Process**: Protecting a page to prevent edit wars or vandalism is a common and well-accepted administrative action on Wikipedia. The discussion revolves around resolving a content dispute through usual channels, which aligns with standard procedures.

4. **Routine Content Dispute**: Such disputes over content edits and their resolution by reaching a consensus are everyday occurrences on a collaborative platform like Wikipedia. This conversation reflects part of that routine negotiation and conflict-resolution process and does not indicate a situation that requires further classification or escalation.

In conclusion, this conversation is a typical example of behind-the-scenes moderation and conflict resolution, which does not necessitate further classification as a distinct incident of broader concern. Thus, maintaining the ""No"" classification is sensible and reflects the nature of the discussion accurately.","The initial classification of 'No' might be incorrect because the conversation explicitly discusses engaging in an edit war and involves an administrative action to protect a page. The conversation mentions user behavior (removing content), referring the issue to another talk page to potentially ban the user, and the act of protecting a page to stop ongoing vandalism. These are clear indicators of an edit war scenario, which typically requires moderation. Therefore, 'Yes' would be a more appropriate classification, as the conversation reflects issues common in edit wars.",Yes
27733774.39983.39983,"I would like to poin out once more that your comments misinform the Wikipedia users. There is actibe discussion going on at wiki_link. Consensus is not reached yet. Why do you lie saying ""restoring consenus"" replaced the article by your extremely biased, Russian Orthodox POV version? If you agree abot something with Ghirlandajo, Kuban Kazak or alike, this is not a consensus yet. Pay attention to other user's opinion. Or you just like the edit war?
I don't like edit wars. There seems to be a consensus at talk judging by number of people, who view lack of canonicity of UOC-KP relevant.",1,1,0,"The conversation clearly shows disagreement rather than consensus. While both parties are engaged in discussing the issue, the initial comment accuses the other of misleading information and bias, whereas the second party defends their position, suggesting the presence of an unresolved conflict. Consensus implies a general agreement among the involved parties, which is evidently not present here. The presence of ongoing discussion and differing viewpoints indicates that consensus has not been reached, justifying a 'No' classification.","The decision to classify this thread as ""Yes"" in the context of a moderation or review process can be supported by examining the content and nature of the conversation. Here are the reasons why this classification is appropriate:

1. **Acknowledgment of Discussion**: The first comment highlights an active discussion and refers to a specific wiki link, indicating ongoing dialogue amongst users. This aligns with the practice of collaborative editing and consensus-building inherent in Wikipedia's model. The presence of a link to a discussion suggests engagement with the community and relevant ongoing discourse, which is encouraged in moderation.

2. **Addressing a Claim of Consensus**: The conversation revolves around whether or not there is a consensus on a particular viewpoint. The second commenter mentions a consensus at ""talk"" and refers to the number of people who find a particular point of view relevant. This demonstrates engagement with other editors and an attempt to ground their actions within a community-agreed framework, which aligns with Wikipedia's principles of reaching consensus.

3. **Concerns About Neutrality and Bias**: The initial commenter's accusations of bias and edit warring indicate active involvement in maintaining Wikipedia's standards for neutrality and objectivity. This concern is central to Wikipedia's editorial process, suggesting the user is engaging with critical aspects of content moderation and dispute resolution.

4. **Effort to Resolve Conflict**: Although the initial comments are accusatory, the second participant expresses a preference against edit wars and attempts to validate their actions by pointing out perceived consensus. This reflects an awareness of Wikipedia's guidelines against edit wars and an effort to align contributions with community standards, further justifying the classification as ""Yes.""

5. **Active Participation and Efforts to Communicate**: Both parties are actively participating in discussion, which is a vital part of the resolution process in Wikipedia editing. The efforts to communicate, even if contentious, indicate engagement with the process required to ensure accurate and balanced articles.

In conclusion, classifying this thread as ""Yes"" affirms that the exchange involves key elements of Wikipedia's procedural and community-driven editing process, such as ongoing discussions, engagement in consensus-building, and attention to neutrality.","The initial classification of 'Yes' is incorrect because the conversation does not show any mutual agreement or acceptance of a decision, which would indicate a consensus. One party accuses the other of misinforming users and being biased, while the other defends their stance, indicating disagreement rather than consensus. The ongoing discussion and lack of agreement among all involved parties do not support a 'Yes' classification for consensus.",No
