conversation_id,text_pair,label,initial_ai_label,debated_ai_label,debated_ai_rationale,pro_view_argument,anti_view_argument,anti_view_suggested_label
143890867.11926.11926,"No more than two editors advocated deletion.  Greatestrowerever and maybe Kymacpherson.  That's not a clear consensus for deletion.  Cheers,
In the future please don't close Afds when you don't have the courtesy of reading the comments.  All comments favored deletion except two.  Please don't be so careless in the future.",1,1,0,"The conversation reflects a disagreement about whether a proper consensus was reached to close the AfD discussion. The first person points out that only a couple of editors explicitly advocated for deletion, contesting that this does not represent a clear consensus. While more participants may have favored deletion, the critical point made is about the lack of a strong, clear consensus, challenging the assumptions that typically lead to a 'Yes' classification. The 'No' label better represents the nature of the discussion as a contestation of the consensus interpretation and the decision-making process surrounding the AfD closure.","The classification of ""Yes"" in this context likely pertains to a decision or agreement being reached regarding the action discussed in the conversation. In this instance, the topic under discussion involves the closing of an Articles for Deletion (AfD) process on Wikipedia. The argument in favor of this classification is centered on whether there was a consensus to close the AfD based on the comments provided.

1. **Consensus Determination**: The classification ""Yes"" supports the idea that the discussion reached a conclusion in which the majority of contributors supported a specific action. In the context of Wikipedia, discussions aim to reach a consensus, not a unanimous decision. From the conversation, it appears there was a predominant lean towards deletion with multiple editors, except for one or two, advocating for removal. This majority view forms the basis of a consensus, thus warranting the closure of the AfD discussion in alignment with community practice.

2. **Interpretation of Comments**: The conversation indicates that ""all comments favored deletion except two."" This implies that only a minority objected, which supports the classification of ""Yes"" in the sense that the AfD decision was backed by the majority of participants. The moderator's decision to close the AfD in favor of deletion aligns with this consensus, and the classification ""Yes"" could be interpreted as validating this alignment with community sentiment.

3. **Decision Integrity and Process**: There is an emphasis within the conversation on the integrity of the decision-making process. The closure, supported by a majority, was executed in keeping with Wikipedia's procedural norms. The classification of ""Yes"" supports the integrity of this procedural decision, affirming that the moderator acted within the bounds of Wikipedia's consensus-driven model.

In summary, the classification ""Yes"" corroborates the decision to close the AfD discussion based on the prevailing consensus for deletion, thereby reflecting the collective judgment of the involved editors.","The initial classification as 'Yes' might be incorrect because the conversation does not clearly express agreement or confirmation. The exchange is more of a discussion or disagreement regarding a decision made about article deletions. The first person argues against the closure of Afds due to insufficient consensus and points out that all comments favored deletion except for two. Therefore, a classification of 'No' would be more accurate, as there is contention rather than agreement between the participants.",No
146743638.12652.12652,"I notice that earier that  moved wiki_link to Bill Chen citing wiki_link , then you reverted this change, Bill Chen doesn't commonly go by William, his book is even penned as Bill Chen. From what I read in WP:COMMONNAME PatrikR seems to be correct, Examples given are names such as: *wiki_link (not wiki_link) *wiki_link (not wiki_link) I think this revert may have been a mistake unless you know otherwise? ▪◦▪
== [WIKI_LINK: WP:COMMONNAME] ==",0,0,0,"The 'No' classification is appropriate because the conversation is a standard editorial discussion about the application of WP:COMMONNAME, which doesn't require moderator intervention. The discussion is occurring in good faith, with editors attempting to reach a consensus on whether 'Bill Chen' or 'William Chen' is more appropriate for the Wikipedia page title. There is no evidence of guideline violation, hostile behavior, or any need for administrative action. Allowing the editors to resolve the dispute through consensus is consistent with Wikipedia's collaborative model.","The initial classification of this conversation thread as 'No' can be supported by understanding the context and the purpose of the WP:COMMONNAME guideline, as well as the content and nature of the discussion.

1. **Understanding WP:COMMONNAME**: The WP:COMMONNAME guideline on Wikipedia is intended to help editors decide on the most appropriate title for a Wikipedia article. This involves using the name that is most frequently used by reliable sources in English to refer to the subject in question. In this case, the discussion revolves around whether ""Bill Chen"" or ""William Chen"" is the more commonly used name.

2. **Nature of the Discussion**: The conversation is between users discussing the suitability of ""Bill Chen"" versus ""William Chen"" for the Wikipedia page title. The user initiating the discussion suggests that reverting the title back to ""William Chen"" might have been a mistake, given that Bill Chen is commonly known by ""Bill,"" even in his publications.

3. **Classification as 'No'**: The classification as 'No' likely refers to whether the conversation itself constitutes any policy or guideline violation, or requires further administrative action. This discussion doesn't indicate any malfeasance, disruption, or misbehavior that would require moderator intervention. Instead, it's a routine editorial discussion about the appropriate application of Wikipedia's guidelines.

4. **Routine Editorial Dispute**: Editorial disputes, especially minor ones about article titles or naming conventions, are common on Wikipedia and are typically resolved through discussion and consensus-building. This conversation is an example of editors engaging in that process, meaning it doesn't necessitate a higher level of scrutiny or intervention.

5. **Encouragement of Consensus**: By classifying it as 'No,' moderators recognize that this is a healthy exchange where editors are encouraged to reach a consensus without unnecessary escalation. It promotes constructive dialogue, which is central to Wikipedia's collaborative editing model.

Given the absence of hostile behavior or disruption and the presence of reasoned debate over a content guideline, the classification of 'No' is appropriate in this context. The moderators' stance supports allowing the community to resolve the issue through standard editorial processes.","The classification 'No' might be incorrect because the conversation revolves around a dispute regarding the use of a common name versus a more formal name in a Wikipedia article. The user suggests that according to WP:COMMONNAME, the change to 'Bill Chen' is more appropriate than 'William Chen' because 'Bill Chen' aligns with how the individual is commonly known and referenced, including in his own works. Therefore, the initial reversion of the change might indeed have been a mistake, aligning with the user's argument in the context.",Yes
144643838.1236.1236,"Please stop removing and altering other editors' comments. What appeared to be valid concern is quickly descending into trolling, and if you continue, you may be blocked from editing. Stop it. -
Well please stop posting incorrect information. If you were right I'd agree with you, and I am NOT trolling.",1,1,1,"The conversation demonstrates potential violations of conduct guidelines with accusations of editing misconduct and possible trolling. There's a clear indication of brewing conflict and escalating behavior, which warrants moderation to prevent further disruption. A 'Yes' classification aligns with the need for early intervention to maintain a respectful and collaborative editing environment and addresses potential misconduct constructively.","In this context, the classification 'Yes' seems to pertain to whether the conversation should be subject to moderation or intervention due to its content and tone. Here are several reasons to support this classification:

1. **Violation of Conduct Guidelines**: The interaction between the editors indicates potential violations of Wikipedia's conduct guidelines, which necessitate civil and constructive discourse. The initial user's message reflects concerns about inappropriate behavior, such as ""removing and altering other editors' comments"" and possible trolling.

2. **Escalation Potential**: The dialogue reveals a brewing conflict that could escalate without moderation. The initial user's warning about a possible block underscores the seriousness of the issue. The respondent's defensive stance and accusation of incorrect postings suggest an unwillingness to resolve differences amicably.

3. **Disruptive Editing Practices**: The accusation of removing and altering comments, coupled with continued argumentative exchanges, highlights behavior that may disrupt the editorial process. This disruptiveness warrants classification as a matter requiring intervention to prevent further disruption.

4. **Preventive Measure**: Classifying the thread as 'Yes' opens the door for early intervention, which is crucial to maintaining the integrity and collaborative spirit of Wikipedia. Addressing potential misconduct early on helps in preserving a respectful and productive environment for all editors.

5. **Guidance and Conflict Resolution**: By classifying this conversation as warranting attention, there's an opportunity for moderators to provide guidance or conflict resolution assistance, ensuring that the concern is addressed constructively and improving editorial collaboration.

Therefore, supporting the classification as 'Yes' aligns with Wikipedia's commitment to fostering a cooperative, respectful, and effective editing environment.","The conversation reflects a dispute between two editors regarding editing behavior and content validity. The initial sentence suggests a warning about potential trolling or disruptive behavior, while the response attempts to defend their own actions as justified. The initial classification of 'Yes' might be indicating clarity or justification of a valid concern, but since this doesn't directly address compliance with typical moderation criteria or specific rules, 'No' could be more suitable. The absence of detailed context about what qualifies as the primary concern makes 'No' more appropriate, as it acknowledges the response does not entirely justify the initial reprimand.",No
127296808.516.516,"If you have problems with my edits to the 4WD page please let me know, do not just revert the edits.  Although the 4WD article is very accurate the introduction is riddled with errors, which I corrected.  I think it is everyone's best interests to make Wiki pages as accurate as possible and the Four Wheel Drive article is not a gleaming example of this. i.e. All-wheel drive is just a marketing term invented to sell primarily on-road 4WD-type cars This is completely inaccurate AWD is no JUST a marketing term. AWD is very different from 4WD and I explained the differences in my edits. There are also blatant contradictions in this introduction as well. So please instead of immediately reverting my edits tell me what your disagreement is.  If you feel that my edit was inaccurate the please let me know why so this can be resolved. Thank You
*Shrug* It *is* just a marketing term. I wish you lot would stop editing it otherwise. Billzilla.",0,1,1,"The conversation clearly centers on a disagreement about the content of a Wikipedia article, specifically the accuracy of the information regarding AWD and 4WD. The initial classification of 'Yes' captures the essence of the dispute, highlighting the presence of conflict due to differing interpretations of technical terms. The dialogue between the original editor and Billzilla indicates misalignment in understanding or valuing the distinctions between AWD and 4WD, underscoring the need for a resolution. Thus, 'Yes' is the appropriate classification because it signifies the existence of a disagreement that requires further discussion and conciliation to ensure the Wikipedia page is accurate and reliable.","The initial classification of ""Yes"" for this discussion likely pertains to the categorization of the conversation as a disagreement or conflict regarding Wikipedia edits. Here’s why the classification is appropriate:

1. **Contentious Edits**: The conversation centers around a disagreement about the edits made to the 4WD Wikipedia page. The original editor believes their corrections improved accuracy, particularly regarding the distinction between AWD (All-Wheel Drive) and 4WD (Four-Wheel Drive), while the respondent dismisses these changes by reinforcing their stance that ""AWD is just a marketing term.""

2. **Request for Dialogue**: The original editor is open to dialogue and resolution, seeking clarity on why their edits were reverted without discussion. They explicitly invite feedback on the perceived inaccuracies, signaling an ongoing conflict that needs addressing.

3. **Contradiction and Resolution**: The conversation highlights a contradiction regarding 4WD and AWD in the article's introduction. The original editor’s appeal to resolve these inaccuracies through discussion rather than blanket reversion underscores the conflict.

4. **Misinterpretation or Disagreement**: The respondent, Billzilla’s, dismissive remark—“It *is* just a marketing term”—illustrates a fundamental disagreement over facts, suggesting a potential misunderstanding or oversimplification of the issue by the respondent.

5. **Need for Accurate Representation**: Accurate representation of technical details (AWD vs. 4WD) is crucial for Wikipedia’s credibility. The editor's concern for accuracy validates the need for classification, as the debate pertains to ensuring reliable information on the platform.

By classifying this conversation as ""Yes,"" it acknowledges the presence of a disagreement that requires attention and resolution to reach a consensus on the content changes in the Wikipedia entry. This classification can help ensure that further appropriate steps are made towards dialogue and content accuracy.","The conversation involves a dispute about content accuracy and differing views on technical definitions, indicative of a content disagreement rather than a simple classification of 'Yes'. The initial classification 'Yes' does not effectively capture the nuanced debate in the discussion, which revolves around the definitions and distinctions between AWD and 4WD, rather than arriving at an agreed-upon resolution or consensus.",No
68000691.25417.25417,"This story about Iran supports the concern that Iraq was trying to get uranium from Africa.  It also confirms the wiki_link saying President Bush comments about Iraq seeking uranium from Africa were ""well-founded.""  It also points out that wiki_link is either incompetent or liar or both.
==Iran caught smuggling uranium==",1,1,1,"The conversation explicitly connects Iranian uranium smuggling to the broader narrative of Iraq allegedly attempting to procure uranium from Africa, a contentious topic that was central to justifications for the Iraq War. The discussion also critiques the credibility of sources related to this narrative. Given the direct references to historical events and debates about nuclear proliferation and political credibility, the classification 'Yes' is appropriate. It captures the essence of discussions that are not just concerned with isolated events, but with their implications in a larger geopolitical and historical context.","The classification of ""Yes"" for this thread indicates that the content indeed has a reference or relationship to the issue of whether Iraq was attempting to procure uranium from Africa, a key point raised in historical discussions and analysis regarding Iraq's WMD capabilities leading up to the Iraq War.

1. **Direct Reference:** The original post makes a direct connection between the Iranian activities and the broader narrative concerning Iraq's alleged attempts to procure uranium from Africa. It references President Bush's comments, which historically were tied to the infamous ""16 words"" in his 2003 State of the Union address. This alone is evidence that the thread is explicitly discussing the factual basis of these allegations.

2. **Historical Context:** The reference to uranium, smuggling, and the potential implications for a nuclear weapons program are critical elements in understanding the global discourse about nuclear proliferation and the justification for military interventions. By bringing such a significant topic to the forefront, the initial post raises issues that were central to international dialogues at the time.

3. **Contentious Nature of Debate:** The thread suggests that there is a dispute over the credibility of sources and statements made by significant political figures or institutions. Such discussions are often pivotal in the classification of posts related to real-world events, as they reflect differing interpretations of evidence and statements. 

4. **Accusations and Credibility Concerns:** The mention of ""wiki_link"" as potentially being ""incompetent or liar or both"" indicates that there is a discourse revolving around the credibility of certain claims or informational repositories. This aligns well with the intention of capturing threads that foster debate over the accuracy and trustworthiness of sources reporting on the subject of Iraq's weapons program.

Overall, the classification of ""Yes"" is warranted as the thread indeed encapsulates a moment in global politics where the pursuit of uranium by Iraq (as linked to Iran by analogy or implication) and statements thereof were embattled in the public and academic domains. The inclusion of this subject matter aligns with the broader intent to archive discussions touching upon pivotal geopolitical and historical issues.","The initial classification of 'Yes' suggests that the conversation is directly related to a particular 'wiki_link,' potentially a specific article or section that supports its claims. However, the conversation seems to be discussing a broader geopolitical issue (Iran smuggling uranium and its implications for Iraq), rather than specifically referring to or verifying the content of a wiki_link. Without knowing what content the wiki_link refers to, it's hard to definitively support or refute it based solely on this short conversation. Therefore, 'No' would be a more appropriate label unless the wiki_link's content is verified to match the conversation’s assertions.",No
66813686.23567.23567,"Please stop including disreputable sources for this article.  Wikipedia policy is quite clear on this matter  blogs and other websites which do not employ editorial oversight of authors' work are not permitted as sources here.  Please stop adding blogs.
==WP:RS==",0,0,1,"The final label 'Yes' is appropriate because the conversation clearly demonstrates an effort to enforce and align with Wikipedia’s guidelines on reliable sourcing. The user's actions are a form of moderation or quality control to ensure that Wikipedia articles adhere to policy standards, specifically WP:RS, which rejects sources such as blogs without editorial oversight. Labeling the conversation as 'Yes' acknowledges that this interaction is about upholding the platform's editorial integrity.","In the context of moderating Wikipedia discussions, the classification of a conversation as ""No"" typically implies that the content or the action discussed is not in alignment with Wikipedia's guidelines or standards. In this case, the original statement concerns the removal of disreputable sources, specifically blogs, due to lack of editorial oversight, which aligns with Wikipedia's policies on reliable sourcing, such as WP:RS (Reliable Sources).

Here’s why the classification of ""No"" is justified and should be supported:

1. **Policy Adherence**: The removal of disreputable sources aligns with Wikipedia’s guideline that stresses using reliable sources. WP:RS clearly states that materials must be from verified, reputable sources to ensure article integrity and accuracy. Blogs, particularly those that lack editorial oversight, are explicitly considered unreliable.

2. **Maintaining Article Quality**: The goal here is to uphold the quality and reliability of Wikipedia articles. By not allowing blogs and other similar sources, which typically do not have rigorous editorial processes, the policy helps safeguard this standard. The classification ""No"" reinforces that adding such sources is not acceptable.

3. **Preventing Misinformation**: Allowing blogs or self-published websites where authorship and editorial process are uncontrolled increases the risk of misinformation. It is crucial for Wikipedia to minimize such risks, thereby protecting the credibility of the platform.

4. **Community Consensus**: The guidelines—from which this classification stems—are developed through broad community consensus. They reflect collective decisions made to ensure Wikipedia content remains trustworthy. The statement in the conversation supports this consensus by discouraging the use of non-reliable sources.

5. **Clarity in Enforcement**: By classifying the response as ""No,"" there is a clear message that certain actions (in this case, adding blogs as sources) are not permissible. This helps enforce existing guidelines consistently and educates contributors on acceptable practices.

Thus, the classification as ""No"" is firmly grounded in Wikipedia’s core principles of accuracy, reliability, and neutrality. It is a necessary moderation decision to uphold and protect the platform's integrity.","Wikipedia's policy against using disreputable sources, such as blogs, indicates a commitment to maintaining high editorial standards. The user's request to stop including sources without editorial oversight aligns with Wikipedia's guidelines for reliable sourcing. The initial classification of 'No' might be incorrect because the content of the conversation directly pertains to enforcing these sourcing policies, which suggests that the user is performing moderation or quality control related to Wikipedia's standards. Therefore, 'Yes' is a more appropriate label as the conversation is indeed related to moderation activities.",Yes
