conversation_id,text_pair,label,initial_ai_label,debated_ai_label,debated_ai_rationale,pro_view_argument,anti_view_argument,anti_view_suggested_label
155594817.14064.14064,"As stated in my edit summaries. wiki_link does not apply in wiki_link violations. *Possibly BLP-violating, is the same as BLP-violating as far as I can tell - and that is an [WP:3R#Exceptions|Exception]] to 3RR. Please allow a discussion to take place and '''reach a consensus'''. So far all we have had is a sparring match consisting of around 5-6 people which has reached a practical stalemate. I am requesting protection, and a RFC so we can develop consensus.
Your hystrionics aside, there was no blp violation. So you clearly broke 3rr. You're just lucky the page was protected.",1,1,1,"The 'Yes' label is appropriate due to the need for administrative intervention prompted by potential violations of Wikipedia’s Biographies of Living Persons (BLP) policy and the Three-Revert Rule (3RR). The conversation indicates a disagreement over the existence of a BLP violation and involves accusations of 3RR breaches, both of which require careful review by administrators. Furthermore, the request for page protection and a Request for Comment (RFC) demonstrates the participants' recognition of the need for community input and consensus-building. These actions align with Wikipedia's procedural approach to resolving disputes and ensuring policy adherence, justifying the classification of 'Yes'.","The classification of ""Yes"" for this thread likely refers to whether or not the conversation meets criteria for administrative intervention or whether it exemplifies the need for enforcing Wikipedia's content policies and guidelines, such as the Biographies of Living Persons (BLP) policy or the Three-Revert Rule (3RR). Here is the rationale for supporting this classification:

1. **BLP Concerns**: The initial part of the conversation raises concerns about potential violations of Wikipedia's BLP policy. This is significant because BLP emphasizes the importance of referencing, neutrality, and caution when editing content related to living individuals. The claim that something is ""possibly BLP-violating"" suggests that there is uncertainty that warrants careful review and potentially qualifies for exceptions under 3RR, which further validates the need for administrative attention and discussion.

2. **Violation of 3RR**: The conversation points out the potential breach of the Three-Revert Rule, a guideline designed to prevent edit warring by limiting the number of reverts an editor can make on a single page within a 24-hour period. Even though there is a disagreement over whether a violation occurred, the accusation itself necessitates classification as ‘Yes’ for further examination and administrative review, especially since it involves contested interpretations of policy.

3. **Request for Protection and RFC**: The request for page protection and a Request for Comment (RFC) indicates that there is unresolved conflict that could benefit from community input and mediation. Calling for an RFC is in itself a constructive step towards building consensus and may also signal the necessity for interim administrative measures to stabilize the situation while a broader discussion takes place.

4. **Resolution and Consensus**: The objective of the user requesting action was to reach consensus and avoid the ""sparring match"" they described, emphasizing the desire for the community's involvement in resolving the dispute. This approach aligns with Wikipedia’s emphasis on collaborative editing and consensus-building, supporting the need for intervention.

Each of these points illustrates why classifying the conversation as 'Yes' is appropriate, acknowledging both the procedural and policy-oriented aspects that require administrative oversight and community engagement.","The initial classification of 'Yes' appears to be correct as the conversation involves a discussion about potential violations of Wikipedia's Biographies of Living Persons (BLP) policy and the Three-Revert Rule (3RR). The conversation participants disagree on whether a BLP violation occurred, and the original poster is seeking a consensus via a Request for Comments (RFC). The request for page protection suggests the situation is contentious, aligning with a scenario where moderator intervention and classification are necessary. Despite the apparent disagreement, the request for protection and consensus-building attempts indicate an acknowledgment of the importance of adhering to Wikipedia's content policies, justifying the 'Yes' classification.",Yes
155716783.14696.14696,"Please do not add the book cover images back into the article. If something comes of the Fair Use Review, they may be added back in then. Thanks
Because an admin told you so CO.",0,0,1,"The conversation does indeed indicate a disagreement or conflict regarding adherence to Wikipedia’s content policies. The initial request emphasizes compliance with fair use policy pending review, which is met with a dismissive response that doesn’t address the policy concerns, suggesting a lack of consensus. The exchange reflects a confrontation rather than an agreement, making ‘Yes’ a more accurate label for indicating disagreement or conflict.","The classification of ""No"" for this conversation likely refers to whether the discussion constitutes a valid consensus or compelling argument to re-add the book cover images into the Wikipedia article. Here are several reasons that support this decision:

1. **Compliance with Fair Use Policy**: The initial comment addresses compliance with Wikipedia's Fair Use policy, indicating that the book cover images should not be re-added until a fair use review has been completed. This aligns with Wikipedia guidelines, which prioritize adherence to legal standards and internal policies over individual opinions or actions.

2. **Lack of Consent**: The user asserting ""Because an admin told you so CO"" does not contribute to a substantive or diplomatic discussion. It reflects a potentially dismissive attitude toward policy adherence and does not provide any new evidence or reasoning that could override the Fair Use considerations initially mentioned.

3. **No Solid Justification Provided**: The conversation lacks a detailed argument or reasoning for why the images should be added back immediately. The mention of an admin's input ('CO') does not constitute a factual or policy-based reason; it seems more akin to deferring without discourse.

4. **Unresolved Nature of Fair Use Review**: The initial statement clearly articulates that re-addition could be contingent on the outcome of the Fair Use review. Since this process has not concluded, there is no new authoritative guideline or decision to act upon.

5. **Discussion Tone and Content**: The exchange seems incomplete and lacks constructive dialogue towards reaching a consensus. The conversation does not explore or debate the merits of the fair use case nor does it suggest potential alternatives, such as replacing the images with text descriptions.

Therefore, supporting the classification of ""No"" is consistent with maintaining Wikipedia’s standards and ongoing adherence to legal and community guidelines in dealing with copyrighted content.","The initial classification 'No' might be incorrect because the conversation indicates a disagreement or a conflict regarding the addition of book cover images to an article. The original message requests compliance with a policy or decision ('Please do not add the book cover images...'), while the response appears confrontational or dismissive ('Because an admin told you so CO.'). This exchange implies a potential conflict or dispute in adhering to Wikipedia's content policies. Therefore, labeling it as 'Yes' (indicating disagreement or conflict) seems more accurate.",Yes
83160877.1204.1204,"Ok now I gotta explain it to you as well. I originally created ""Who is Black"" and someone else changed it to ""definitions of black people"" without an explanation. Still there is no explanation to this day. For some reason you and others seem to adhere to using ""Definitions of Black People"" and ignore the obvious unfairness of doing so. I've covered all the bases, I've explained my position, I've sought arbitration, and I've not received a proper response from anyone. At this point it is wrong and totally out of Wikipedian rules to continue to change the original title.
Just leave it be. ""Definitions of black people"" is a much better title. Go discuss it at the talk page if you wish to change it, again. —",1,0,0,"The final label 'No' is appropriate because the suggested title 'Definitions of Black People' aligns with Wikipedia's principles of neutrality, clarity, and comprehensiveness. It provides a neutral and informative scope that reflects potential complex discussions around racial identity. The recommendation for addressing the issue on the talk page aligns with Wikipedia's procedures for handling content disputes, enhancing transparency and encouraging consensus-building. Although concerns about adherence to protocol during the title change are noted, these can be effectively addressed through proper channels, supporting the decision to keep the current title unless consensus suggests otherwise.","The classification 'No' seems to imply that the request made by the original author to revert the title back to ""Who is Black"" is not supported. Here’s why this classification is justified and appropriate:

1. **Neutral Point of View**: Wikipedia operates on a principle of presenting information from a neutral point of view. The title ""Definitions of Black People"" is more neutral and less subjective than ""Who is Black,"" which could be interpreted as implying there is a contested question or a singular answer. ""Definitions of Black People"" suggests a coverage of various perspectives and acknowledges the complexity of racial identity, which aligns with Wikipedia's guidelines for balanced and impartial content.

2. **Clarity and Scope**: A good Wikipedia title should clearly convey the content and scope of the article. ""Definitions of Black People"" more accurately describes an article likely discussing the various cultural, historical, and social definitions of black identity across different contexts. It suggests a broader examination which likely reflects the varied content within the article. ""Who is Black"" might mislead readers into expecting a definitive or simple classification, which is not feasible or appropriate given the complexity of racial identity.

3. **Talk Page Engagement**: The user responding suggests discussing changes on the talk page, which is the correct procedural channel for Wikipedia editorial disputes. This encourages community involvement and consensus-building, which is how Wikipedia content is developed and maintained. By recommending discussion on the talk page, the responder is adhering to Wikipedia’s process for resolving editorial differences respectfully and collaboratively.

4. **Prior Discussion and Consensus**: The mention of a lack of explanation for the initial change suggests that there may not have been proper documentation initially. However, encouraging discussion on the talk page provides an opportunity to rectify this, ensuring future transparency and consensus. It implies that consensus (or at least a review of past discussions) has already been achieved in favor of ""Definitions of Black People,"" which is why the current classification supports keeping it as is.

In summary, the classification of 'No' is in line with Wikipedia's principles of neutrality, clarity, and consensus. It supports maintaining the current title as it appears more neutral and representative of the article's content and offers a procedural path for discussion and potential change through appropriate channels.","The initial classification of 'No' might be incorrect because the conversation suggests a dispute over the title of an article, which could be considered vandalism or disruption if not properly resolved through discussion. The user who wants to keep the original title says that the change was made without explanation and seeks arbitration, which implies that protocol may not have been followed. They believe the move from the original was unjustified and not in line with Wikipedian rules, indicating that the change might be inappropriate without proper consensus. Evaluating the situation contextually, the suggested label of 'Yes' acknowledges that the issue may indeed have elements of being against Wikipedia's guidelines for making consensual changes.",Yes
95273157.1954.1954,"When you uploaded to commons, what license did you select?
I didn't upload it to the commons. It was already there.—",0,0,0,"The classification 'No' is appropriate because the conversation does not involve any actionable issue regarding content licensing or misuse that requires moderation. The response clarifies that the person did not upload to Commons, thus negating the premise of potential licensing responsibility or conflict. The conversation lacks any indication of a violation or contentious debate, which supports not labeling it as needing intervention. While the question-answer dynamic might suggest a binary response format, the presence of merely a negation without further issue supports a 'No' classification regarding the need for moderation or concern about policy breach.","The classification of ""No"" in this conversation appears to be based on determining whether the conversation involves any direct violation or issue related to content licensing on Wikimedia Commons. Here’s the argument for why the classification as ""No"" is appropriate:

1. **Nature of the Inquiry:** The question ""When you uploaded to commons, what license did you select?"" indicates an inquiry into the licensing status of an image or media file. However, this is a procedural question and not indicative of any underlying problem or conflict.

2. **Response and Context:** The respondent clarifies that they did not upload the file; it was already present on Wikimedia Commons. This suggests there is no personal action by the respondent that could directly involve any licensing disputes or issues. They are distancing themselves from the responsibility of selecting or determining the license.

3. **Lack of Conflict or Debate:** The conversation does not exhibit a disagreement, misunderstanding, or a need for mediation relating to Wikimedia Commons guidelines or policies. The exchange is straightforward and lacks contentious elements.

4. **No Indication of Misuse:** There is no mention or indication in the conversation of misuse, incorrect licensing, or any activity that requires intervention or further investigation by a moderator. The file's presence on Commons implies it was uploaded by someone following standard procedures unless evidence to the contrary is presented.

5. **Procedural Clarification:** The dialog only clarifies the procedural aspect of the file being on Commons and does not delve into any substantive issues that would necessitate a ""Yes"" classification concerning legal, ethical, or community guideline breaches.

In summary, the classification ""No"" signifies that there is no specific issue requiring moderation in this context. The conversation does not signify a licensing concern needing corrective action or moderation oversight, supporting the ""No"" classification.","The initial classification of 'No' might be considered incorrect because the conversation involves a question that can be answered with a yes or no response. The question, 'When you uploaded to commons, what license did you select?' implies an inquiry about a previous action, and the response clarifies the situation by denying the occurrence of that action ('I didn't upload it to the commons.'). The response effectively is a 'no' to the action of uploading, alongside additional context. In terms of classification, this exchange encompasses a binary yes/no element that corresponds with the terminology of the question 'did you select?'. Therefore, 'Yes' might be a more accurate classification given the conversational context of questioning and negating an action.",Yes
325209973.9766.9766,"Please see wiki_link and wiki_link. Athlete states, ""People who have competed at the fully professional level of a sport,"" wiki_link is professional, the players get paid making it a profession. BB Notability states ""the article must cite published secondary source material which is reliable, intellectually independent, and independent of the subject,"" and they do. These are the guidelines I follow, do you have something that states the contrary?
== Minor leaguers ==",1,0,0,"The final label of 'No' is determined based on the broader context of Wikipedia's notability guidelines, which prioritize significant independent coverage and recognition of influence or impact. Although the athlete competes at a professional level, the argument hinges on the presence of adequate reliable secondary sources. Without verification of the cited sources providing substantial analysis or coverage that extends beyond the basic details of participation in the sport, the claim to notability is insufficient. Moreover, Wikipedia's consistent application of these standards for notability suggests that mere professional participation without additional achievements, recognition, or substantial coverage does not meet the requirements. Therefore, the 'No' classification is aligned with these notability expectations.","The classification decision of 'No' in this context likely pertains to whether the conversation or the subject matter adheres to the notability guidelines necessary for a Wikipedia entry. The guidelines require that a topic must have significant coverage from reliable, independent, secondary sources. In the situation described:

1. **Professional Level Argument**: The issue seems to center around whether participation in a certain sport or league qualifies someone as ""notable"" enough for Wikipedia. While the players may indeed be paid, making it professional, not all professional athletes automatically meet Wikipedia's notability requirements, particularly if the league or events aren't widely covered in significant detail by independent, reliable sources.

2. **Secondary Sources**: The argument references ""BB Notability,"" indicating the necessity of published secondary source material that is reliable and independent. It's not enough for a league to be professional; there needs to be secondary coverage discussing the significance of the league or athletes in question. This coverage must provide broader context and indicate that the subject is of interest beyond routine or transactional reporting.

3. **Guideline Adherence**: Without the cited sources available for review, if they don't provide substantive analysis or coverage beyond basic facts, they might not meet Wikipedia's standards for notability. For an athlete or subject to be considered notable on Wikipedia, there generally needs to be evidence of impact, influence, or recognition beyond mere participation.

4. **Precedent and Consistency**: Wikipedia strives for consistency in its articles. If minor league participation or players typically haven't met notability criteria without additional achievements or recognition, maintaining a 'No' classification ensures consistency with past decisions.

Thus, the 'No' classification is likely appropriate if the backing sources don't sufficiently demonstrate notability by Wikipedia's standards, focusing on extensive, independent coverage rather than the mere fact of professional participation.","The initial classification of 'No' might be incorrect based on the guidelines mentioned in the conversation. The athlete in question competes at a fully professional level as defined by the criteria for a professional, where players are paid, satisfying the requirement for a sport to be professional. Additionally, the BB Notability guidelines require reliable, published secondary sources that are intellectually independent and independent of the subject, which the speaker claims to have followed. Without evidence to the contrary presented in the conversation, the arguments suggest that the criteria for notability and professional status are met. Therefore, 'Yes' would be a more appropriate classification, as it acknowledges that the guidelines have been followed.",Yes
318141830.5953.5953,"You have been '''wiki_link''' from editing for  to prevent further wiki_link caused by your engagement in an wiki_link. During a dispute, you should first try to wiki_link and seek wiki_link. If that proves unsuccessful you are encouraged to seek wiki_link, and in some cases it may be appropriate to request wiki_link. If you believe this block is unjustified, you may wiki_link by adding the text {{unblock|''your reason here''}} below.  at wiki_link, per a complaint at wiki_link.
Im not going to contest the block because I know what I did is wrong, but I just want to say you sort of did it in a shady way. First you said you werent going to, and then you just saw us trying to discuss it on your talk page, which now we can't.",0,1,1,"The final label 'Yes' is appropriate because the conversation is centered on the administrative action of blocking a user on Wikipedia, which aligns with Wikipedia's established procedures for managing user behavior. The user acknowledges their wrongdoing, reinforcing the justification for the block. The discussion involves Wikipedia's dispute resolution processes and administrative actions, both of which are relevant to the enforcement of community standards. There is no indication of inappropriate or unjustified actions, and the conversation remains focused on Wikipedia's policies, supporting the classification of 'Yes'.","The classification of 'Yes' in this context indicates that the conversation is relevant and appropriate to the issue at hand—specifically, addressing the block of a user on Wikipedia. Here's why this classification is suitable:

1. **Relevance to Wikipedia Processes:** The conversation directly pertains to Wikipedia's administrative processes, specifically user blocks, and the user's response to that block. Wikipedia has specific guidelines for blocking users, and this conversation highlights the user’s acknowledgment of their understanding and acceptance of the block, which aligns with Wikipedia's policies.

2. **Clear Acknowledgment of Misconduct:** The user explicitly acknowledges wrongdoing (""I know what I did is wrong""), which is critical in verifying the appropriateness of the block. This acknowledgment is a key factor in discussions about user conduct on Wikipedia, supporting the classification.

3. **Reference to Standard Dispute Resolution:** The conversation mentions various pathways for dispute resolution on Wikipedia (e.g., seeking mediation, filing an unblock request, etc.). This indicates the conversation is focused on Wikipedia's processes and confirms the appropriateness of the classification.

4. **Focus on Administrative Actions:** The issue of blocking users is an administrative action governed by Wikipedia's guidelines. The conversation's focus on the block and its justification requires acknowledgment according to Wikipedia's policies, affirming the thread's proper classification.

5. **Evidence of Due Process:** The user was blocked following a complaint, presumably following Wikipedia’s guidelines. The conversation reveals the consistency in handling the user’s case with Wikipedia's procedural norms, supporting the decision to classify the discussion appropriately.

Overall, the classification as 'Yes' suggests that this conversation is justified and aligned with Wikipedia's procedures for handling disputes, user conduct, and administrative actions. This decision ensures that the discussion meets Wikipedia's standards for content and community interaction.","The initial classification of 'Yes' seems to be focusing on whether the conversation involves a valid intervention in the editing process, such as blocking an inappropriate editor. The text indicates that a block was enforced due to behavior considered inappropriate. The response acknowledges wrongdoing, which supports the classification of 'Yes' as it agrees with the validity and necessity of the intervention based on established Wikipedia procedures. There is no indication that the block was without cause; the editor acknowledges their error. The label 'Yes' fits as the original message and the response are consistent with maintaining Wikipedia's community standards.",Yes
