conversation_id,text_pair,label,initial_ai_label,debated_ai_label,debated_ai_rationale,pro_view_argument,anti_view_argument,anti_view_suggested_label
324215291.8824.8824,"external_link, is the creator of the RFC/U CoM? (his own RFC/U?) Is the italicized text yours or CoM's? Thanks.
He created the RFC with the sentence ""I think he's awesome!!!"" I noticed from the ANI thread I just closed that it was a bluelink, so I clicked on it, and when I saw that I deleted it. The entire message is from me to CoM, italicized by Twinkle because I entered it into the comment box when adding the template. (I've never subscribed to to the idea of wiki_link) .",0,0,0,"The conversation focuses on procedural clarification and the user's role in managing content on Wikipedia, specifically regarding the deletion of an RFC due to inappropriate content. The user clarifies that they did not create the RFC/U but deleted it due to the language used, which contradicts claims of their authorship of the RFC/U. The italicized text mentioned was entered during a procedural action via Twinkle, further supporting that the user's comments were a procedural response rather than ownership of the original content. Therefore, the 'No' classification is accurate, as the topic of authorship or creation of the RFC/U does not apply here.","The classification of this conversation as ""No"" is appropriate and can be supported based on the context and content provided. Here's why:

1. **Clarification of Action**: The user is clarifying an action they took—deleting an RFC due to inappropriate content (""I think he's awesome!!!""). This indicates that the RFC was created by someone else, not by the user who deleted it. Therefore, the question of whether the creator of the RFC/U was the user themselves or not makes the classification ""No"" accurate, indicating that the creator was different.

2. **Explanation of Context**: The user explains that the italicized text in question was theirs, entered via Twinkle, a Wikipedia tool, during the process of adding a template. This shows that the italicized text was not created or written by the original poster of the RFC/U, nor was it purported to belong to CoM.

3. **Focus on Procedure and Tools**: The conversation references Wikipedia-specific procedures (such as ANI and the use of Twinkle for commenting and templating), focusing on how tools and processes were used rather than on content issues related to user behavior or personal opinions. This procedural nature supports the ""No"" classification as it doesn't directly relate to the personal conduct or disputes that might be implied otherwise.

4. **Absence of Discussion on RFC/U Ownership**: The conversation lacks specifics on the original ownership or authorship of the RFC/U other than the action taken by the responder, reinforcing a ""No"" classification because it does not align with a statement of authorship or alignment.

In summary, the classification as ""No"" succinctly captures that the topic ascribed does not apply to this context, where the primary discussion involves procedural clarification and the user’s action in relation to content management on Wikipedia.","The conversation indicates that the external link and the italicized text were inquired about. The initial classification of 'No' might be incorrect because evidence within the conversation indicates that the text marked with Twinkle was indeed created by the user in question, in the context of interacting with CoM. Thus, the correct classification is possibly 'Yes', as this response generates from the user's action of entering text into the comment box, showing a level of authorship or involvement with the creation of the text.",Yes
316041407.7114.7114,"First off, external_link/AGF, knock it off~! If you seriously think that J_E is my sock then why not start a SPI? Secondly, I'm of the opinion that the said image on article page can be updated to reflect the latest model/design, per wiki_link. Lastly, name callings of your fellow editor will lead you to nowhere in terms of AGF, you should know that since you're a seasoned editor. Why can't you have the courtesy of thinking that other editors are here to help improve the article? Other than the obvious vandalism edits, why is it that you always think of the worst of others. Have you forgotten that Wikipedia is a collabarative effort? I won't mince my word but you really ought to be ashame of yourself! ''  ''
Who are you and why do you appear when I find myself embroiled in conflict with someone else only to oppose me for the sake of confronting me? I'm beginning to think this is no longer a bizarre coincidence. My frustration stems mostly from the fact that 99% of the editors DO NOT improve the article, but instead, whether it be good intentions or not, tear away at it piece by piece. Have you noticed that there hasn't been any significant CONTENT or cited material contributed apart from my work? Take a look through the history. I'm either reverting Malaysian space rangers from the Users list or quarreling over some totally redundant details like I am now. I'm aware of two, possibly 3 editors actually introducing quality content. It's frustrating.",1,1,1,"The conversation exhibits a clear pattern of conflict and behavior issues that require moderation intervention. The presence of accusations of sockpuppetry, failure to assume good faith, aggressive tone, and dissatisfaction with editing contributions align with issues that are commonly addressed by Wikipedia moderation. These issues fall within areas of concern for upholding Wikipedia's standards of civility, respect, and collaboration. Classifying it as 'Yes' indicates the need for addressing these behavioral issues to foster a better collaborative environment, which is critical to maintaining the integrity and cooperative nature of the Wikipedia community.","The initial classification of this conversation as ""Yes"" is likely rooted in recognizing the presence of key indicators that align with issues commonly addressed by Wikipedia moderation. Here's why this classification is justified:

1. **Conflict and Accusations**: The conversation reflects a clear conflict between two editors, which is an area of concern for maintaining a collaborative and respectful editing environment. The mention of potential sockpuppetry (""If you seriously think that J_E is my sock then why not start a SPI?"") is a serious accusation that could undermine trust within the editing community.

2. **Assumption of Bad Faith**: The discourse hints at a lack of adherence to the ""Assume Good Faith"" (AGF) guideline, with one party accusing others of always thinking ""the worst of others."" Addressing such attitudes is crucial to fostering a more constructive and cooperative editing atmosphere.

3. **Aggressive Tone and Hostility**: Terms like ""knock it off"" and ""you really ought to be ashamed of yourself"" convey a confrontational and hostile tone. This contravenes Wikipedia’s behavioral norms, which prioritize civility and respect among editors.

4. **Content Contribution and Quality Concerns**: There is an expressed frustration regarding the quality of contributions from other editors. The mention of ""99% of the editors DO NOT improve the article"" and disputes over content accuracy reflect a struggle to maintain article quality, a common moderation issue that affects Wikipedia’s reliability.

5. **Engagement with Wikipedia Policies**: References to processes and guidelines, such as engaging in a Sockpuppet Investigation (SPI) and discussing content updates per guidelines, highlight the necessity for editors to properly utilize Wikipedia’s established conflict resolution mechanisms. This conversation exemplifies a failure to adequately employ such structures.

By classifying this thread as ""Yes,"" it underscores the importance of actively addressing these issues to uphold Wikipedia's community standards and ensure productive collaboration. Properly managed, this intervention can mitigate conflict and guide editors towards more constructive interactions, aligning with Wikipedia's overarching mission to be a collaborative knowledge repository.","The initial classification 'Yes' implies that the conversation is clearly related to an incident or pattern of behavior that is being confirmed, such as acknowledging a previous incident. However, the conversation instead reflects a dispute between editors on Wikipedia, where one user accuses another of not assuming good faith (AGF) and being unnecessarily confrontational. Another user responds with frustration over perceived lack of contribution from other editors. The core of the conversation revolves around differing views on editing behavior and content contribution, not on confirming a specific situation. Therefore, 'No' would be a more appropriate classification as the conversation is not about confirming a previous incident but rather discussing ongoing disagreements and perceptions about editing practices.",No
314540585.6679.6679,"US Government websites not only host government created works - see the disclaimers for defenseimagery.mil or army.mil. Per the EXIF, and maybe per the description in the past, this photgraph was not taken by an US employee but an Australian soldier and is not public domain per  or similar licenses like PD-USGov-Military-Navy/Army.
If it is published by a federal entity, is it not PD?",0,0,0,"The label 'No' is the most accurate classification because the photograph in question is authored by a non-U.S. entity, specifically an Australian soldier. Under U.S. copyright law, works created by non-U.S. government employees do not automatically enter the public domain, even if they are published on a U.S. government website. The publication of the photograph on a federal entity's platform does not override copyright laws regarding authorship. Disclaimers on government websites often indicate that not all content is eligible for public domain status. Thus, the original classification 'No' correctly reflects legal considerations related to the work's authorship and corresponding copyright restrictions.","The classification of ""No"" is appropriate given the context and the information provided in the conversation. The fundamental issue revolves around the origin and authorship of the photograph in question. Here are several key points supporting this decision:

1. **Authorship by a Non-U.S. Entity**: The conversation indicates that the photograph was taken by an Australian soldier, not a U.S. government employee. According to U.S. copyright law, only works created by U.S. federal government employees as part of their official duties are automatically placed into the public domain. Since this photograph was created by a foreign national, it is not subject to the same rules.

2. **Federal Entity Publication Does Not Equate to Public Domain**: Just because a photograph is published on a U.S. government website does not necessarily mean it is in the public domain. The public domain status is determined by the authorship and the nature of the work, not merely by its appearance or availability on a government-hosted platform. Websites such as defenseimagery.mil and army.mil might contain content not covered under the public domain if the creators of such content are not U.S. government employees or have not relinquished their copyright.

3. **Disclaimers on Government Websites**: The mention of “disclaimers” on these websites serves as a caution that not all works found there are U.S. government works exempt from copyright. These disclaimers typically clarify that third-party, non-U.S. government-authored content is subject to copyright protection.

4. **Legal and Ethical Considerations**: Ensuring respect for the copyright of foreign nationals and other non-U.S. entities is a crucial ethical and legal responsibility. Misclassifying such work as public domain could lead to unauthorized use and potential legal repercussions.

Taking these points into account, the decision to classify the thread as ""No"" appropriately reflects the considerations regarding the rights and origin of the photograph. This classification helps maintain the accuracy and integrity of copyright distinctions.","The initial classification 'No' might be incorrect because the conversation raises a pertinent question about whether a work published by a federal entity, even if created by a non-U.S. government employee, falls into the public domain. While the comment notes that the photograph was taken by an Australian soldier, it also indicates that the photo is published by a federal entity. If a work is published on a U.S. government website, it's possible that the work could still be considered public domain under U.S. law, despite its origins, as per policies that govern such publications. It is essential to analyze whether the publishing entity has the right to release it into the public domain. Hence, the label 'Yes' could be more appropriate, assuming this consideration applies.",Yes
197685544.5110.5110,"I do wish whoever is deleting this section would stop doing so or at least discus it first. It's a perfectly reasonable contribution. : I don't see why the word 'probably' is inappropriate. It's a well known fact that far more records were sold in the 1960s than now so it is an intelligent, reasonable thought.
== Legacy section ==",1,0,0,"The decision to maintain the label 'No' is justified based on Wikipedia's content guidelines. The conversation primarily addresses editorial behavior rather than discussing or enhancing article content, which is more suitable for a talk page discussion. Furthermore, the lack of citations and the speculative nature of the claims do not meet the standards for inclusion in a main article. Ensuring the integrity and quality of content requires adherence to verifiable and well-supported information. Therefore, the conversation should not be incorporated into the encyclopedic content, supporting the 'No' label.","The decision to classify this thread as 'No' is appropriate because the conversation does not align with the characteristics typically required for a substantial, encyclopedic entry. Here's why:

1. **Lack of Citation and Verification**: Statements like ""it's a well known fact that far more records were sold in the 1960s than now"" lack citations. Wikipedia prioritizes verifiable and sourced information. Any factual claim, particularly one that aims to influence the historical understanding of a topic, should be backed by reliable sources.

2. **Subjectivity and Speculation**: The use of terms like ""probably"" indicates speculation rather than definitive, evidence-based assertions. Wikipedia's content guidelines emphasize the need for objective, neutral, and well-supported contributions.

3. **Discussion Not Related to Article Content**: The conversation seems to focus more on the behavior of editors (e.g., the deletion of sections) rather than on enhancing or clarifying the content of the article itself. Discussions about editorial behavior, while potentially important, often belong on talk pages rather than being incorporated into the article content.

4. **Relevance to Article**: The conversation lacks specific references to the content of a ""Legacy"" section within an article, making it difficult to discern its direct relevance or contribution to the topic at hand, thus weakening the argument for its necessity in context.

5. **Editorial Tone**: The conversational tone observed here is more aligned with unstructured discussion than with the formal, encyclopedic language expected in Wikipedia articles. The purpose of article content is to inform and educate, guided by strong editorial standards.

Each of these points supports the classification of ""No"" for incorporating this conversation into the main content of an article, preserving the integrity and quality expected from Wikipedia entries.","The conversation indicates a strong suggestion that there is a dispute regarding the deletion of a section, which implies editorial conflict. The participant feels the contribution is valid and expresses frustration over its removal without discussion, suggesting there is enough contention to warrant moderation. Therefore, the classification should reflect the presence of an editorial issue, making 'Yes' a more appropriate label.",Yes
211538523.5868.5868,"Well I noticed that it does not include the chart postions for the 70's line-ups fro 74-77 on Disco so I added them( look a discography). It shows they had 3 disco #1's and rest top 5 which is never talk about anywahere. The thing is this artcale saids basically the 70's line-up was struggling. Yes in terms of R&B; and Pop in 1973 and onward but in Disco they had great success and should be noted on this artcle that they were succelful in Disco and had 3 #1 Disco hits. Also that the 2 line-ups found new success in Disco and had and that that they regained some of their fame in the form of the Disco hits. I am also edditing the top samples things and including the songs in the 70's that wer top 10 Disco and will provide a sample of them soon, Thank you, Saimaroimaru_2008.
== Disco Success ==",0,0,0,"The conversation lacks the necessary elements to meet Wikipedia's standards for inclusion. While the user attempts to provide additional information regarding the disco success of a musical group, the submission fails to meet Wikipedia's requirements for neutrality, verifiability, and encyclopedic tone. The information is presented informally, without citing reliable sources, and includes subjective language. Furthermore, it does not adhere to Wikipedia’s format and integration guidelines. Until these issues are addressed with a more structured, sourced, and clearly integrated submission, the content cannot be considered suitable for inclusion on Wikipedia.","The classification of ""No"" for the inclusion of this conversation can be justified based on several factors:

1. **Relevance and Focus**: The conversation, while discussing the disco success of a particular musical group's 1970s lineup, lacks a structured and encyclopedic tone suitable for a Wikipedia article. Wikipedia emphasizes neutrality, verifiability, and a formal tone, which are not entirely present in the conversation. The user's comments are more opinionated and subjective rather than providing objective and citable information.

2. **Sourcing and Verification**: The user mentions adding chart positions based on a discography but does not provide direct references or citations from reliable sources to support these claims. Wikipedia's content guidelines require information to be verifiable with credible sources, which is missing here.

3. **Formatting and Clarity**: The text is informal, featuring numerous spelling and grammatical errors, which detract from its clarity and professional presentation. Wikipedia articles are expected to maintain a high standard of language and formatting to ensure reader comprehension.

4. **Content Integration**: The user proposes edits related to the disco success of the group without a clear plan for integrating this information into the existing article structure. Wikipedia content should seamlessly incorporate new information into the existing narrative, maintaining coherence and relevance throughout the article.

5. **Subjective Language**: Phrases like ""never talk about anywahere"" and ""great success"" indicate subjective interpretation rather than an objective analysis of data. Wikipedia articles should avoid value-laden language.

6. **Original Research**: The user intends to include new content based on personal assessments and interpretations of disco charts without indicating reliance on secondary sources. Wikipedia discourages original research, preferring content backed by published, reputable analyses.

For these reasons, classifying the article as ""No"" aligns with Wikipedia's standards for neutrality, verifiability, and encyclopedic tone.","The initial classification of 'No' implies that the conversation content is irrelevant or incorrect in terms of contributing to the article. However, the user's input discusses the chart success of the 70's line-ups in Disco music, specifically mentioning chart positions and number one hits. This is relevant information that provides a more comprehensive view of the subject matter, correcting the article's oversight about the success during that era. Such contributions are significant as they enhance the article's accuracy and depth by shedding light on aspects that were previously overlooked. Therefore, the classification should be 'Yes', indicating that this input is indeed helpful and relevant to improving the article.",Yes
322358989.5975.5975,"You're being discussed here:
== Just so you know II ==",1,0,0,"The arguments supporting the 'No' classification are stronger in this context. The initial statement 'You're being discussed here' followed by a section header and no additional context or details does not provide enough actionable content or evidence of policy violations to necessitate intervention. Without specific indication of problematic behavior or a breach of guidelines, the content is purely informational and not inherently suspicious or requiring attention. In the absence of explicit issues or requests for moderation, maintaining the 'No' classification is appropriate to avoid unnecessary administrative action.","The classification of the thread ""No"" underlines that it does not meet certain criteria or guidelines requiring action or special attention. Here are the arguments in favor of this classification:

1. **Lack of Actionable Content**: The thread simply states ""You're being discussed here"" followed by a section header ""== Just so you know II =="". This statement doesn’t include any specific requests for intervention, no identification of problematic behavior, or issues needing moderation or resolution.

2. **Absence of Context**: Without additional context or information surrounding the statement, it’s unclear what the discussion pertains to or whether it violates any community guidelines or policies. The vagueness makes it unsuitable for further action, reinforcing a 'No' classification since there’s no indication of a problem that requires attention.

3. **No Evident Policy Violation**: The content provided does not demonstrate any evidence of violation of Wikipedia’s content policies or guidelines. There's no indication of harassment, personal attacks, edit wars, or any other behavior that typically necessitates a 'Yes' classification, which would warrant a different type of response or intervention.

4. **Informational Nature**: The phrase “Just so you know” suggests an informational intent rather than a call to action. If the purpose is simply to notify or inform another editor about a discussion, it does not require moderation unless that discussion is in breach of policy which, based on this snippet, is not evident.

5. **Normal Discussion Dynamics**: Editors frequently engage in discussions about content or actions. Merely being mentioned in a discussion is not inherently problematic or in need of administrative attention unless it crosses into territory of personal attacks or undue criticism.

Overall, the 'No' classification indicates that the content of the thread doesn't require administrative intervention, doesn't represent an actionable issue, and doesn't compromise the integrity of the collaborative environment. This supports a decision to not pursue any action or reclassification at this juncture.","The phrase 'You're being discussed here:' followed by a link suggests that the user is being referenced or discussed on another page or section of the platform. This indicates a point of concern or discussion directly involving the user, which aligns with situations typically requiring attention or notification. Therefore, classifying it as 'Yes' may be more appropriate, as it implies there is something the user needs to be aware of or address.",Yes
